{
  "$schema": "http://json-schema.org/draft-07/schema#",
  "title": "RegistryDocument",
  "description": "Schema for a document in the data registry. Each JSON file in data/registry/ represents one document to be ingested into Weaviate.",
  "type": "object",
  "required": ["name", "source", "content", "format"],
  "properties": {
    "name": {
      "type": "string",
      "description": "Human-readable document name or title."
    },
    "source": {
      "type": "string",
      "description": "Source label, e.g. 'Participedia Case Studies', 'GovLab', 'Reboot Democracy'."
    },
    "source_url": {
      "type": "string",
      "description": "Original URL for citation (optional).",
      "default": ""
    },
    "doc_date": {
      "type": "string",
      "description": "Document date in ISO format, e.g. '2021-04-12' (optional).",
      "default": ""
    },
    "content_type": {
      "type": "string",
      "description": "Content classification. If omitted, the pipeline will auto-classify via LLM.",
      "enum": [
        "case_study", "transcript", "blog_post", "journal_article",
        "report", "guide", "policy_brief", "lecture", "tool_or_resource", "other"
      ]
    },
    "content": {
      "type": "string",
      "description": "Full document text content (Markdown or plain text)."
    },
    "format": {
      "type": "string",
      "description": "Content format.",
      "enum": ["markdown", "plain_text", "pdf"],
      "default": "markdown"
    },
    "pdf_path": {
      "type": "string",
      "description": "Relative path to the PDF file (only when format is 'pdf')."
    },
    "ingested_at": {
      "type": "string",
      "description": "ISO timestamp of when this document was last ingested (set by the pipeline)."
    },
    "document_id": {
      "type": "string",
      "description": "Stable UUID for this document (auto-generated by the pipeline if not provided)."
    }
  }
}
