{
  "name": "Faith In/And Democracy Pilot Project",
  "source": "Participedia Case Studies",
  "source_url": "https://participedia.net/case/6152",
  "doc_date": "2019-10-18",
  "content_type": "case_study",
  "content": "Note: the following entry is a stub. Please help uscomplete it.Problems and Purpose Background History and Context Organizing, Supporting, and Funding Entities Participant Recruitment and Selection Methods and Tools Used What Went On: Process, Interaction, and Participation Influence, Outcomes, and Effects Analysis and Lessons Learned See Also References External Links Notes",
  "format": "markdown"
}