{
  "name": "Planification Cells on Intergenerational Relationships in an Aging Society (Rheinland-Pfalz, Germany)",
  "source": "Participedia Case Studies",
  "source_url": "https://participedia.net/case/7337",
  "doc_date": "2021-04-01",
  "content_type": "case_study",
  "content": "Problems and Purpose Background History and Context Organizing, Supporting, and Funding Entities The ministry of work, family and healthcare of the state of Rheinland-Pfalz commissioned the planification cells on the topic of population aging. Participant Recruitment and Selection The selection unfolded in two stages. First, four locations within the state were selected “on social and economic criteria” (no further details). Then, participants were randomly drawn from population registers: the population included all residents aged 16 or more, including foreigners and secondary residence owners. 1,500 people were sent invitations and 162 eventually participated (i.e. about 40 per commune). Methods and Tools Used What Went On: Process, Interaction, and Participation A total of 162 participants met between June and July 2004 in eight planification cells (two in each of the four selected locations: Mainz, Trier, Vallendar, and Kusel) held on four consecutive days from 8 am to 4 pm. Participants were asked to think about the challenges raised by population aging and possible solutions.Influence, Outcomes, and Effects A written report with policy recommendations (e.g. legal minimum pensions, flexible retirement age, financial support for continuing education for aging workers) was handed over to political authorities in December 2004. The exact policy impact remains unknown. Analysis and Lessons Learned See Also References External Links Notes This entry is based on the POLITICIZE dataset. More information can be found at the following links:Paulis, Emilien; Pilet, Jean-Benoit; Panel, Sophie; Vittori, Davide; Close, Caroline, 2020, \"POLITICIZE Dataset\",https://doi.org/10.7910/DVN/Z7X6GT , Harvard Dataverse, V1Pilet J-B, Paulis E, Panel S.,Vitori D &amp; Close C. 202X The POLITICIZE Dataset: an inventory of Deliberative Mini-Publics (DMPs) in Europe. European Political Science.",
  "format": "markdown"
}