{
  "name": "Peasant Guard of Catatumbo",
  "source": "Participedia Case Studies",
  "source_url": "https://participedia.net/case/5650",
  "doc_date": "2020-10-04",
  "content_type": "case_study",
  "content": "Problems and Purpose The Peasant Guard of Catatumbo (Span. Guardia Campesina del Catatumbo) is a regional peasant security collective whose purpose is to defend the territory and the human rights of those who live there. The initiative arose as an organ of the Catatumbo Peasant Association during the context of the National Agrarian Strike of 2013, and was formalized in the regional constitution of Catatumbo in 2014. It was born out of the need for a peasant security corps to maintain peace in the communities of the region. It confronts threats from armed actors only through dialogue and peaceful conflict resolution. The Peasant Guard of Catatumbo takes as its model the organization, methods, and struggles of the Indigenous Guard in Cauca . Background History and Context Organizing, Supporting, and Funding Entities Participant Recruitment and Selection Methods and Tools Used What Went On: Process, Interaction, and Participation Influence, Outcomes, and Effects Analysis and Lessons Learned See Also References External Links Notes",
  "format": "markdown"
}