{
  "name": "Open Knowledge Advocacy in Tanzania",
  "source": "Participedia Case Studies",
  "source_url": "https://participedia.net/case/5989",
  "doc_date": "2019-08-16",
  "content_type": "case_study",
  "content": "Note: the following entry is a stub. Please help uscomplete it.Problems and PurposeBy conducting workshops, trainings, and meetings as well as building partnerships with aligned organizations, CC Tanzania has reached thousands and built the framework for continued partnership and cooperation within Tanzania and beyond.[1]Background History and Context Organizing, Supporting, and Funding Entities Participant Recruitment and Selection Methods and Tools Used What Went On: Process, Interaction, and Participation In 2014, CC Tanzania hosted a creative event for kids at the Open University of Tanzania, the first university in the region to offer open and distant learning programs. Participants used the Internet and open educational resources to create animations. Three training programs were held around ICT empowerment training for unemployed youth, teaching persons with disabilities how to use computers, and training educators on using ICT to improve how they teach their students.[2]In 2017, CC Tanzania provided trainings for students, young librarians, and lawyers and promoted Open Access and Open Data in Africa through their accelerated community building work.[3]Influence, Outcomes, and Effects Analysis and Lessons Learned See Also References [1] State of the Commons 2017, https://stateof.creativecommons.org/[2] Jane Park, 'Creative Commons launches School of Open events in Tanzania and Nigeria', https://creativecommons.org/2014/09/12/creative-commons-launches-school-of-open-events-in-tanzania-and-nigeria/[3] State of the Commons 2017, https://stateof.creativecommons.org/External Links CC Tanzania https://www.facebook.com/cc.tanzania/Creative Commons Blog https://creativecommons.org/tag/cc-tanzania/Notes",
  "format": "markdown"
}