{
  "name": "Dallas Independent School District Participatory Budgeting",
  "source": "Participedia Case Studies",
  "source_url": "https://participedia.net/case/6178",
  "doc_date": "2019-10-19",
  "content_type": "case_study",
  "content": "Problems and Purpose Background History and Context Organizing, Supporting, and Funding Entities Participant Recruitment and Selection Methods and Tools Used What Went On: Process, Interaction, and Participation Influence, Outcomes, and Effects Analysis and Lessons Learned See Also References External Links Notes",
  "format": "markdown"
}