{
  "name": "Pays de la Loire, 2040",
  "source": "Participedia Case Studies",
  "source_url": "https://participedia.net/case/6810",
  "doc_date": "2020-08-12",
  "content_type": "case_study",
  "content": "Problems and Purpose Background History and Context Organizing, Supporting, and Funding Entities Participant Recruitment and Selection Methods and Tools Used What Went On: Process, Interaction, and Participation Influence, Outcomes, and Effects Analysis and Lessons Learned See Also References External Links NotesData was sourced from OECD (2020), Innovative Citizen Participation and New Democratic Institutions: Catching the Deliberative Wave , OECD Publishing, Paris, https://doi.org/10.1787/339306da-en .",
  "format": "markdown"
}